Category,Primary Risk,Risk Level,Early Warning Indicator 1,Early Warning Indicator 2,Early Warning Indicator 3,Recommended Monitoring Frequency,Escalation Threshold
Meat and Poultry,Microbiological contamination,High,Increase in positive environmental monitoring results at processing facility,Customer complaint rate for gastrointestinal symptoms above 0.1 per 10000 units,Deviation from critical control point temperature logs at any processing step,Daily environmental swabs at critical control points,2 consecutive positive environmental results OR any customer illness complaint
Bakery and Snacks,Undeclared allergen,High,Any change to ingredient supplier without updated allergen declaration review,Production scheduling puts allergen-containing product before allergen-free product without validated cleaning,Label artwork change without cross-functional sign-off including regulatory affairs,Pre-production allergen checklist for every run involving allergen-free claims,Any unverified ingredient substitution OR any label change without sign-off
Dairy and Eggs,Microbiological contamination,High,Coliform counts in finished product trending upward over 3 consecutive lots,Cold chain temperature excursion at any point from processing to retail,Seal integrity failure rate on finished product above 0.05%,Lot-by-lot microbiological testing for high-risk SKUs,Any temperature excursion above 4 degrees Celsius for more than 2 hours
Prepared and Packaged Foods,Undeclared allergen and labelling error,High,Any reformulation without updated label review and regulatory sign-off,Supplier ingredient specification change notification received,Customer complaint describing allergic reaction or label discrepancy,Quarterly label audit against current formulation and regulatory requirements,Any allergic reaction complaint OR any label discrepancy identified at retail
Fruits and Vegetables,Microbiological contamination and chemical contamination,Medium,Supplier audit score below 80% on food safety criteria,Pesticide residue test result above 50% of maximum residue limit,Weather event (flooding or drought) at primary growing region,Incoming lot testing for microbial and pesticide residues on high-risk produce,Any pesticide result above MRL or any positive Listeria result in ready-to-eat produce
Pharmaceuticals,Process deviation and labelling error,Medium,Out-of-specification result during in-process testing at any manufacturing step,Deviation from batch record at any critical step without documented investigation,Complaint rate for incorrect dosage or unexpected side effects above baseline,Batch release testing for all critical quality attributes before distribution,Any OOS result OR any batch record deviation at a critical control point
